{"id": "2026-07-25_tsetlin-clause-pruning", "date": "2026-07-25", "title": "Validation-based clause pruning un-buries the planted DNF: at 20% label noise a 500-sample NOISY validation set restores Tsetlin clause precision 0.49 -> 1.00 with zero recall loss, and the binding constraint is the unknown noise rate, not the missing clean labels", "slug": "tsetlin-clause-pruning", "hypothesis": "Scoring each learned Tsetlin clause by its individual precision on a held-out validation set drawn from the same NOISY distribution, and pruning the low-precision clauses, restores clause precision to ~1.0 on the noise-buried rule set of 2026-07-24 at eps=0.2 without hurting exact recall or accuracy; at eps=0.3, where recall was already degraded to 0.556, pruning either helps or amputates the surviving true clauses.", "question": "Can post-hoc, label-noise-blind clause pruning/weighting separate the planted clauses from the spurious noise-fitted ones that bury them in a Tsetlin Machine, and at what noise level does that separation fail?", "method": "Reuse the pure-numpy Tsetlin Machine and planted 3-clause DNF generator of 2026-07-24_tsetlin-dnf-recovery verbatim (identical rng streams; baselines reproduce that run exactly, max abs diff 0.0 over 12 matched runs). Train 20-clause TMs (T=10, s=3.0, 60 epochs, 3000 samples) at label-flip eps in {0.0, 0.2, 0.3, 0.4} x 3 seeds. Score every clause on a held-out validation set drawn from the SAME noisy distribution (n in {100, 500, 2000}) by coverage and validation precision P(y=polarity | clause fires). Compare three treatments: (a) a 51-point pruning-threshold sweep (oracle upper bound), (b) a naive oracle-free rule keeping clauses within 0.95x the best clause precision, (c) a Wilson rule that estimates the unknown precision ceiling 1-eps as the largest Wilson lower bound over well-covered clauses and keeps every clause whose Wilson upper bound reaches it; plus a soft weighting variant. Re-measure clause precision, exact clause recall, mean best Jaccard, clean test accuracy, functional accuracy over all 1024 inputs, soundness of kept clauses, and DNF read-off accuracy.", "architecture": "vanilla two-class Tsetlin Machine, 20 clauses x 20 literals (400 automata), pure numpy, no gradients; post-hoc clause scoring/pruning/weighting on top", "dataset": {"name": "planted 3-clause DNF over 10 boolean variables (same generator as 2026-07-24)", "source": "generated", "license": "n/a"}, "task": "boolean rule learning / post-hoc symbolic rule cleanup under label noise", "framework": "numpy (no torch)", "seed": 0, "compute": "CPU, 1 thread, 237s for 12 trained TMs plus the full pruning sweep", "metrics": {"clause_precision_eps020_before": 0.486, "clause_precision_eps020_after_wilson": 1.0, "exact_recall_eps020_before": 1.0, "exact_recall_eps020_after_wilson": 1.0, "dnf_readoff_acc_eps020_before": 0.643, "dnf_readoff_acc_eps020_after_wilson": 1.0, "test_acc_eps020_before": 0.937, "test_acc_eps020_after_wilson": 0.89, "clause_precision_eps030_before": 0.192, "clause_precision_eps030_after_wilson_n500": 0.34, "clause_precision_eps030_after_wilson_n2000": 1.0, "exact_recall_eps030_before": 0.556, "exact_recall_eps030_after_wilson": 0.556, "clause_precision_eps040_after_wilson": 0.067, "best_swept_tau_precision_eps020_no_recall_loss": 1.0, "best_swept_tau_precision_eps030_no_recall_loss": 1.0, "best_swept_tau_precision_eps040": 0.667, "naive_rule_exact_recall_eps020": 0.444, "weighting_mass_on_planted_eps020": 0.858, "weighting_mass_on_planted_uniform_eps020": 0.667, "reproduces_2026_07_24_exactly": true, "headline": "at eps=0.2 an oracle-free pruning rule scored on 500 NOISY validation labels restores clause precision 0.486 -> 1.000 with exact recall untouched at 1.0 and the read-off DNF functionally perfect (0.643 -> 1.000); at eps=0.3 it never amputates (recall stays 0.556) and reaches precision 1.0 given 2000 validation samples; at eps=0.4 nothing separates (0.067)"}, "result_summary": "Hypothesis confirmed at eps=0.2, partially at eps=0.3, refuted at eps=0.4 - and the real obstacle is the unknown noise rate, not the absence of clean labels. Because a logically sound clause's validation precision concentrates at 1-eps, the useful pruning thresholds form a narrow band just below 1-eps. A naive 'keep clauses within 0.95x of the best' rule AMPUTATES (eps=0.2: precision 1.0 but exact recall 1.0 -> 0.444, accuracy 0.937 -> 0.820) because a lucky low-coverage clause sets the ceiling too high; replacing the raw max with a Wilson lower bound over clauses covering >=5% of the validation set fixes it exactly. That rule takes eps=0.2 from clause precision 0.486 to 1.000 with zero recall loss in all 3 seeds - the surviving positive clauses are exactly the 3 planted ones and reading them off as a DNF is functionally perfect (0.643 -> 1.000). At eps=0.3 pruning never removes a planted clause that training kept (recall stays 0.556) and reaches precision 1.0 with 2000 validation samples (0.34 with 500). At eps=0.4 the signal is gone (precision 0.067; best oracle threshold only 0.667). Cost: pruning both polarities unbalances the vote, so the pruned TM loses ~4.7 accuracy points at eps=0.2 (0.937 -> 0.890) even though the oracle threshold tau=0.74 gives precision 1.0 AND accuracy 0.978; soft weighting instead of pruning is safer but weaker (weight mass on planted clauses 0.667 -> 0.858, never a clean list). Baselines reproduce 2026-07-24 exactly (max abs diff 0.0).", "status": "done", "novelty_check": {"checked_on": "2026-07-26", "verdict": "partial-prior-art", "sources": [{"name": "web", "query": "Tsetlin machine clause pruning validation precision noisy labels rule extraction", "hits": 10}, {"name": "web", "query": "weighted Tsetlin machine clause weighting spurious clauses interpretability arXiv 2002.01245", "hits": 9}], "conclusion": "Clause weighting and literal/clause pruning for Tsetlin Machines are established, but as TRAINING-time mechanisms for compactness (weighted TM 1911.12607 / 2005.05131 / 2002.01245, literal pruning 2411.04557, clause-size constraints IJCAI 2023, Drop Clause 2105.14506). The fresh contribution here is post-hoc pruning scored on a NOISILY labelled validation set and evaluated against a planted ground-truth DNF, which pins down exactly when it restores clause precision to 1.0, that it does not amputate true clauses at eps=0.3, and that the binding constraint is the unknown noise rate 1-eps rather than the lack of clean labels. arXiv/OpenAlex APIs 403 from this environment; web search used instead."}, "prior_art": ["https://arxiv.org/abs/1911.12607", "https://arxiv.org/abs/2005.05131", "https://arxiv.org/abs/2002.01245", "https://arxiv.org/abs/2411.04557", "https://www.ijcai.org/proceedings/2023/0378.pdf", "https://arxiv.org/abs/2105.14506"], "related_ids": ["2026-07-24_tsetlin-dnf-recovery"], "links": {"folder": "experiments/2026-07-25_tsetlin-clause-pruning", "results_json": "experiments/2026-07-25_tsetlin-clause-pruning/results.json", "chart": "experiments/2026-07-25_tsetlin-clause-pruning/chart.png"}, "tags": ["non-transformer", "tsetlin-machine", "rule-recovery", "interpretability", "label-noise", "clause-pruning", "follow-up", "cpu-only"]}
