{"id": "2026-07-25_trm-nano-sudoku", "date": "2026-07-25", "title": "TRM at nano scale: the outer refinement loop is the whole story, the inner latent recursion is not", "slug": "trm-nano-sudoku", "hypothesis": "At ~0.1M params on 4x4 Sudoku, TRM-style recursion (arXiv:2510.04871) buys accuracy mainly through the OUTER refinement loop (repeatedly re-encoding a full candidate solution) rather than through INNER latent recursion at matched core-block applications; and per the TRM critique (arXiv:2512.11847) most of the achievable full-puzzle solve rate is already present at recursion depth 1.", "question": "When you split TRM recursion into its two halves and hold parameters and core-block applications exactly equal, which half buys generalization - and does solve rate saturate at recursion depth 1?", "method": "One 2-layer MLP core (LN -> 256x192 -> GELU -> 192x256) on a flat 256-d state (16 cells x 16-d), applied exactly T times in three arms that differ ONLY in the information path between steps: (a) outer_deepsup - state passes through the 16x4 answer distribution, re-embedded, CE loss at every step; (a') outer_finalsup - same loop, CE at the final step only (deep-supervision control); (b) inner_latent - state is the full-width 256-d latent z (z <- z + core(x+z)), decoded once at the end. T=1 is the single-pass baseline where all arms collapse to one core application. Identical param count (116,624) everywhere; full backprop through the loop (no TRM 1-step gradient approximation). Depths T in {1,2,4,8}, 3 seeds, 24 runs. 1200 steps, batch 128, AdamW lr 3e-3 (40-step warmup + cosine), wd 0.01, grad-clip 1.0; every run reaches 1.000 solve rate on the training puzzles, so this compares generalization at converged train fit.", "architecture": "TRM-style weight-tied 2-layer MLP recursion, 116,624 params, 16-cell flat state, T in {1,2,4,8} core applications", "dataset": {"name": "synthetic 4x4 Sudoku; all 288 valid grids enumerated, split by SOLUTION GRID into 202 train / 86 held-out; puzzles are 4-8-given maskings rejection-sampled for a unique solution (2000 train, 800 held-out-grid test, 800 seen-grid unseen-mask test; mean 9.15 blanks)", "source": "generated in run.py (seeded backtracking enumeration + uniqueness-checked rejection sampling)", "license": "n/a (synthetic)", "hash": "n/a (regenerated deterministically from seed 0)"}, "task": "4x4 Sudoku completion (constraint satisfaction); metrics on blank cells only", "framework": "torch 2.13", "seed": 0, "compute": "CPU single-threaded, 398.8s for all 24 runs", "metrics": {"unseen_solve_rate_outer_deepsup_T1": 0.2204, "unseen_solve_rate_outer_deepsup_T2": 0.3392, "unseen_solve_rate_outer_deepsup_T4": 0.4484, "unseen_solve_rate_outer_deepsup_T8": 0.5129, "unseen_solve_rate_outer_finalsup_T2": 0.4092, "unseen_solve_rate_outer_finalsup_T4": 0.4808, "unseen_solve_rate_outer_finalsup_T8": 0.5496, "unseen_solve_rate_inner_latent_T1": 0.2175, "unseen_solve_rate_inner_latent_T2": 0.23, "unseen_solve_rate_inner_latent_T4": 0.2342, "unseen_solve_rate_inner_latent_T8": 0.245, "unseen_cell_acc_outer_deepsup_T8": 0.8255, "unseen_cell_acc_outer_finalsup_T8": 0.8464, "unseen_cell_acc_inner_latent_T1": 0.7597, "unseen_cell_acc_inner_latent_T8": 0.7367, "single_pass_baseline_unseen_solve_rate": 0.2195, "single_pass_baseline_unseen_cell_acc": 0.7618, "delta_outer_minus_inner_solve_rate_T8": 0.2679, "delta_outer_minus_inner_cell_acc_T8": 0.0888, "delta_deepsup_minus_finalsup_solve_rate_T8": -0.0367, "frac_of_best_at_depth1_outer_deepsup": 0.4297, "frac_of_best_at_depth1_outer_finalsup": 0.401, "frac_of_best_at_depth1_inner_latent": 0.8878, "seen_grid_solve_rate_outer_deepsup_T8": 0.9033, "seen_grid_solve_rate_inner_latent_T8": 0.7217, "trainset_solve_rate_all_runs": 1.0, "unseen_solve_rate_std_max": 0.0296, "n_params": 116624, "headline": "at matched compute the outer answer-space refinement loop scales (0.220 -> 0.513 solve rate, T=1 -> 8) while inner latent recursion is flat (0.218 -> 0.245); +0.268 solve rate for outer over inner at T=8; deep supervision is NOT the cause (final-step-only supervision is better, 0.550); the critique's '94% at recursion step 1' holds for latent recursion (89%) and fails for the refinement loop (40-43%)"}, "result_summary": "Hypothesis confirmed on the mechanism, refuted on the saturation claim - and the two results are the same finding seen from two sides. Splitting TRM recursion into mutually exclusive information paths through one identical 116k-param core at exactly matched core-block applications: the OUTER refinement loop (state passes through the 16x4 answer distribution) climbs 0.220 -> 0.339 -> 0.448 -> 0.513 held-out-grid solve rate at T=1/2/4/8, while INNER latent recursion (full-width 256-d z, decoded once) is essentially flat at 0.218 -> 0.245 over the same 8x compute, a +0.268 gap at T=8 with per-cell seed std <= 0.030. Latent depth is not merely useless: its held-out cell accuracy DECREASES with depth (0.760 -> 0.737) while its seen-grid solve rate rises 0.533 -> 0.722, i.e. extra latent recursion buys memorization capacity rather than constraint propagation. TRM-style deep supervision is not the cause of the outer loop's win - supervising only the final step is better (0.550 vs 0.513 at T=8, and 0.409 vs 0.339 at T=2). The TRM critique's '94% of performance at recursion step 1' therefore splits by which recursion is ablated: fraction of best-depth solve rate already present at T=1 is 0.89 for inner latent (claim roughly holds) but only 0.40-0.43 for the outer refinement loop (claim refuted). Caveats: one task, a 16-cell CSP with only 288 total solutions, 1200 steps, and the outer curve is still rising at T=8 so its saturation point was not found.", "status": "done", "novelty_check": {"checked_on": "2026-07-25", "verdict": "partial-prior-art", "sources": [{"name": "web", "query": "Tiny Recursive Model TRM outer refinement loop vs inner latent recursion ablation Sudoku", "hits": 9}, {"name": "web", "query": "arXiv 2512.11847 TRM critique 94% performance recursion step 1", "hits": 9}], "conclusion": "TRM (2510.04871, 7M params, 9x9 Sudoku-Extreme/ARC/Maze) ablates the recursion COUNTS n and T inside its full architecture, and the ARC-AGI-1 critique (2512.11847) reports most performance at recursion step 1; allthingssecurity/trm_sudoku is a reimplementation, not an ablation. No prior work found that isolates the two recursion mechanisms as MUTUALLY EXCLUSIVE information paths through one identical core at exactly matched core-block applications, adds a deep-supervision control, or evaluates on held-out SOLUTION GRIDS rather than held-out puzzles. arXiv/OpenAlex APIs 403'd from this environment; used web search."}, "prior_art": ["https://arxiv.org/abs/2510.04871", "https://arxiv.org/abs/2512.11847", "https://github.com/samsungsailmontreal/tinyrecursivemodels", "https://github.com/allthingssecurity/trm_sudoku"], "related_ids": ["2026-07-25_shadow-loop-vs-depth-isoflop", "2026-07-25_shadow-recursion-capacity-window", "2026-07-21_gol-depth-recursion"], "links": {"folder": "experiments/2026-07-25_trm-nano-sudoku", "results_json": "experiments/2026-07-25_trm-nano-sudoku/results.json", "chart": "experiments/2026-07-25_trm-nano-sudoku/chart.png"}, "tags": ["track-a", "shadow", "arc-prize", "latent-reasoning", "recursion", "trm", "refinement-loop", "test-time-compute", "sudoku", "matched-compute", "ablation", "cpu-only"]}
