{"id": "2026-07-25_shadow-halt-entropy-tiny", "date": "2026-07-25", "title": "Shadow E3: entropy-based adaptive exit on a tiny looped char LM - no better than a coin flip at matched compute", "slug": "shadow-halt-entropy-tiny", "hypothesis": "On a weight-tied looped char LM (max k=4, ~0.06M params) trained with per-loop deep supervision, an inference-time per-token entropy exit traces a better val-bits/char vs mean-loops/token frontier than fixed loop counts, i.e. adaptive halting saves compute without hurting loss by spending loops only on high-entropy tokens. The competing prediction (TRM critique 2512.11847) is that it collapses to a fixed depth because loops past the first buy almost nothing at this scale.", "question": "Does Ouro-style entropy halting recover any of the loss that the plain tied loop takes at iso-FLOPs (registry id 2026-07-25_shadow-loop-vs-depth-isoflop), by allocating loops only where they are needed?", "method": "One pre-norm decoder block (d=64, 4 heads, d_ff 256, ctx 64, vocab 65) weight-tied and applied up to k_max=4 times, LM head readable after any loop; 62,272 params. Four models x 2 seeds, identical hyperparameters (1800 steps, batch 16, AdamW lr 2e-3, 100-step warmup + cosine, wd 0.1, clip 1.0): fixed_k1/k2/k4 (CE on the final loop only) and deepsup_k4 (CE averaged over readouts after loops 1..4). Three inference-time policies swept on deepsup_k4 over the SAME 51,200 fixed val tokens: (i) fixed k in {1,2,3,4}; (ii) entropy exit - after loop i a token with predictive entropy <= tau halts, its hidden state freezes but still serves as a key/value, 15 thresholds tau in [0, 6.1] bits; (iii) random exit - compute-matched control where each active token halts with probability p, p solved numerically so mean loops/token matches each entropy point. Metric: val bits/char vs mean loops/token, plus a FLOP-honest axis charging the entropy probe for its per-loop LM-head evaluation (7.8% of a block). Ablation: entropy exit on the non-deep-supervised fixed_k4 model.", "architecture": "weight-tied looped decoder-only transformer, k_max=4, d_model 64, 62.3k params, per-loop LM readout", "dataset": {"name": "tiny-shakespeare (character level, 65-char vocab)", "source": "https://raw.githubusercontent.com/karpathy/char-rnn/master/data/tinyshakespeare/input.txt", "license": "public domain text; karpathy/char-rnn MIT", "hash": "md5 6fb458f1232090904fb40fe944165e91"}, "task": "character-level language modelling / next-character prediction with per-token adaptive depth", "framework": "torch 2.13", "seed": 0, "compute": "CPU single-threaded, 472.5s for 8 training runs plus all inference sweeps", "metrics": {"n_params": 62272, "deepsup_fixed_k_bpc": {"k1": 2.9488, "k2": 2.9123, "k3": 2.9103, "k4": 2.9203}, "separately_trained_fixed_k_bpc": {"k1": 2.8556, "k2": 2.8912, "k4": 2.935}, "best_interior_delta_vs_fixed_bpc": 0.0005, "best_interior_mean_loops": 3.9579, "delta_vs_fixed_at_15pct_saving_bpc": 0.0072, "delta_vs_fixed_at_27pct_saving_bpc": 0.015, "delta_vs_fixed_at_39pct_saving_bpc": 0.0212, "entropy_minus_random_at_39pct_saving_bpc": 0.0058, "entropy_minus_random_at_61pct_saving_bpc": 0.0116, "mean_entropy_minus_random_interior_bpc": 0.0016, "frac_tokens_using_loops_2_or_3_max_over_tau": 0.059, "frac_tokens_at_full_depth_at_tau_0.45": 0.975, "deepsup_bpc_gain_k1_to_k3": 0.0385, "deepsup_k1_minus_dedicated_k1_bpc": 0.0932, "deepsup_k4_minus_dedicated_k4_bpc": -0.0147, "naive_exit_on_fixed_k4_bpc_at_1_loop": 3.837, "equiv_loops_flops_at_tau_0": 4.3125, "headline": "entropy halting never beats fixed depth (best interior point +0.0005 bpc for a 1% compute saving; +0.021 bpc at a 39% saving) and is statistically indistinguishable from a compute-matched RANDOM exit above 3.4 loops/token, becoming strictly worse than random below it (+0.0058 / +0.0116 bpc at 39% / 61% savings); loops 2-3 are used by <6% of tokens at any threshold"}, "result_summary": "Hypothesis refuted, honest negative. Every entropy operating point sits on or above the fixed-k frontier of the same model: the best interior point is +0.0005 bits/char for a 1% compute saving, and a real saving costs real loss (+0.0072 / +0.0150 / +0.0212 bpc at 15% / 27% / 39% fewer loops). The decisive control is the compute-matched RANDOM exit: above 3.4 loops/token entropy is within +-0.0007 bpc of coin-flipping (inside the 0.003 seed spread) and below it entropy is strictly WORSE than random (+0.0022/+0.0058/+0.0116 bpc at 2.93/2.44/1.56 loops), so the entropy signal carries no usable information about which tokens need more depth. The policy does collapse, but to MAXIMUM depth rather than the shallow collapse the TRM critique predicts: at any threshold costing under 0.001 bpc, >=96% of tokens still run all four loops (char-level Shakespeare is a ~2.9 bits/char target, so almost nothing looks easy), and loops 2 and 3 are used by <6% of tokens at any threshold, i.e. the mechanism degenerates into a binary 1-or-4 easy/hard split rather than graded allocation. The upstream reason is that there is nothing to allocate: the deep-supervised model's quality-vs-depth curve is nearly flat and non-monotone (k1 2.9488, k2 2.9123, k3 2.9103, k4 2.9203) and the separately trained fixed-k models get monotonically worse with more loops (2.8556 / 2.8912 / 2.9350 at k=1/2/4), so the globally best point in the experiment is the dedicated k=1 model - fewest loops AND lowest bpc. Two side results: deep supervision is a hard prerequisite (naive entropy exit on the non-deep-supervised k4 model degrades 2.935 -> 3.837 bpc) but is not free (its k=1 readout is 0.093 bpc worse than a dedicated k=1 model, exactly where you would want to exit); and FLOP-honest accounting charges the entropy probe 7.8% of a block per loop, putting its zero-exit operating point at 4.31 loop-equivalents, i.e. above fixed k=4. Caveats: 1800 steps at 0.06M params is an early-training iso-compute regime (2.85-2.95 bpc, far from converged), one task, 2 seeds, inference-time exit only, and mean loops/token is a compute proxy - no wall-clock saving is claimed.", "status": "done", "novelty_check": {"checked_on": "2026-07-25", "verdict": "partial-prior-art", "sources": [{"name": "web", "query": "entropy-based early exit adaptive halting looped recurrent-depth language model ablation small scale", "hits": 9}, {"name": "web", "query": "Ouro looped language model exit gate entropy adaptive depth loops per token", "hits": 9}, {"name": "web", "query": "'early exit' entropy threshold 'random exit' compute-matched control baseline no better than random transformer", "hits": 8}, {"name": "web", "query": "Adaptive Depth in Looped Transformers Halting Gates Trajectory Readouts scale", "hits": 10}], "conclusion": "Entropy/confidence early exit is a well-established mechanism (ACT, PonderNet, DeeBERT-style) and adaptive depth in looped LMs is colonised at >=1B (Ouro 2510.25741, MoR 2507.10524), but none of that work ablates below 1B. Three things appear untested: the <=0.1M-param regime, the compute-matched RANDOM-exit control (not found as a baseline in the early-exit literature, and the control that makes 'adaptive saves compute' falsifiable), and the explicit precondition that the fixed-k quality curve must be steep before a halting rule can pay off. Provisional caveat: search surfaced several 2026-dated preprints in exactly this area - 2607.20519 'Adaptive Depth in Looped Transformers: Diagnosing Learned Halting Gates and Trajectory Readouts', LoopFormer 2602.11451, ADEPT 2601.03700, 2606.18206, 2607.13491 - whose contents could NOT be verified because arXiv 403s/rate-limits from this environment; 2607.20519 may overlap substantially. No numbers from 2026-dated preprints are relied on."}, "prior_art": ["https://arxiv.org/abs/2510.25741", "https://arxiv.org/abs/2507.10524", "https://arxiv.org/abs/2512.11847", "https://arxiv.org/abs/2607.20519", "https://arxiv.org/abs/2107.05407", "https://arxiv.org/abs/1603.08983"], "related_ids": ["2026-07-25_shadow-loop-vs-depth-isoflop", "2026-07-25_shadow-recursion-capacity-window", "2026-07-21_gol-depth-recursion"], "links": {"folder": "experiments/2026-07-25_shadow-halt-entropy-tiny", "results_json": "experiments/2026-07-25_shadow-halt-entropy-tiny/results.json", "chart": "experiments/2026-07-25_shadow-halt-entropy-tiny/chart.png"}, "tags": ["shadow", "track-e", "latent-reasoning", "recursion", "looped-transformer", "adaptive-depth", "early-exit", "entropy-halting", "test-time-compute", "matched-compute-control", "negative-result-for-hypothesis", "cpu-only"]}