{"id": "2026-07-25_grokking-modular-addition", "date": "2026-07-25", "title": "Grokking (a+b) mod 59: spectral-entropy collapse LAGS the test-accuracy jump; only restricted loss leads", "slug": "grokking-modular-addition", "hypothesis": "A 1-layer LayerNorm-free transformer trained full-batch on a fraction of (a+b) mod 59 will memorize fast and generalize late (grokking), and the spectral entropy of its token-embedding matrix will COLLAPSE measurably BEFORE the test-accuracy jump - making it a predictive online progress measure competitive with Nanda's restricted/excluded loss.", "question": "Does spectral-entropy collapse actually LEAD the grokking transition, or merely describe the grokked state - and how does it compare head-to-head against restricted/excluded loss on the same runs?", "method": "1-layer transformer (no LayerNorm, no biases) on [a, b, '='], logits read at the last position only; full-batch AdamW (lr 1e-3, weight decay 1.0, betas 0.9/0.98), seed 0. Train-fraction sweep 0.5 / 0.4 / 0.3 of the 3481 pairs with per-run wall-clock caps (150/360/90 s). Four progress measures tracked every 50 steps: H_fourier (entropy of the DFT power spectrum of W_E down the token axis, DC dropped), H_svd (entropy of the normalized singular-value energy spectrum of W_E), H_cov (entropy of the penultimate-representation covariance eigenspectrum - the arXiv:2604.13123 measure, reimplemented), and Nanda restricted/excluded loss (logits over the full p x p grid, centered over the output axis, 2D-DFT'd over (a,b), split on the FINAL model's key frequencies and replayed against periodic in-RAM checkpoints). Lead time is measured from the MEMORIZATION step (train acc >= 0.99), comparing when each measure completes 50% of its post-memorization movement against when test accuracy crosses 0.5. Two controls: (a) the same primary run re-analysed as if training had STOPPED at the jump, isolating the normalization artifact; (b) a train_frac 0.3 run that memorizes but never leaves the plateau, giving a false-positive rate.", "architecture": "1-layer attention+MLP transformer, no LayerNorm, d_model 64, 4 heads, d_mlp 256, vocab 60, 56,960 params", "dataset": {"name": "all 59^2 = 3481 (a,b) pairs of (a+b) mod 59; deterministic random splits at train_frac 0.5 (1740/1741), 0.4 (1392/2089), 0.3 (1044/2437)", "source": "generated in run.py from the seed", "license": "n/a (synthetic)"}, "task": "modular addition (a+b) mod 59, held-out pair generalization", "framework": "torch 2.13", "seed": 0, "compute": "CPU single-threaded, 600.0s of training across 3 runs (618.8s total incl. replay + chart)", "metrics": {"n_params": 56960, "p": 59, "n_runs": 3, "primary_train_frac": 0.5, "primary_step_memorized": 220.0, "primary_step_test_acc_50": 862.5, "primary_grok_delay_steps": 642.5, "primary_final_test_acc": 1.0, "primary_steps_run": 4056, "key_freq_power_share_grokked": 0.9047, "n_key_frequencies": 6, "H_fourier_init_bits": 4.8479, "H_fourier_final_bits": 2.9016, "effective_n_frequencies_init": 28.8, "effective_n_frequencies_final": 7.47, "lead_H_fourier_steps": -936.0, "lead_H_svd_steps": -876.0, "lead_H_cov_steps": -570.9, "lead_restricted_loss_steps": 351.1, "lead_excluded_loss_steps": 562.5, "frac_collapse_done_at_test50_H_fourier": 0.145, "frac_collapse_done_at_test50_H_svd": 0.2472, "frac_collapse_done_at_test50_H_cov": 0.1372, "frac_done_at_test50_restricted_loss": 0.8376, "spectral_entropies_lead_on_completed_run": false, "measures_that_lead": ["excluded_loss", "restricted_loss"], "truncation_artifact_cut_step": 900, "lead_H_fourier_if_truncated_at_jump": 297.5, "lead_H_svd_if_truncated_at_jump": 385.6, "lead_H_cov_if_truncated_at_jump": 146.4, "false_positive_control_train_frac": 0.3, "false_positive_control_final_test_acc": 0.0283, "false_positive_control_chance": 0.0169, "false_positive_control_steps": 4388, "false_positive_H_svd_drop_bits": 0.9761, "false_positive_H_fourier_drop_bits": 0.1205, "false_positive_H_cov_drop_bits": -0.4787, "false_positive_key_freq_power_share": 0.3586, "partial_run_train_frac": 0.4, "partial_run_grok_delay_steps": 11021.3, "partial_run_final_test_acc": 0.5242, "partial_run_steps": 11477, "mid_checkpoint_step": 200, "headline": "p=59, train_frac 0.5 groks fully (memorized step 220, test acc 50% at step 862, delay 642 steps, final test acc 1.000, 6 frequencies holding 90.5% of embedding power); but every spectral entropy LAGS the jump (H_fourier -936, H_svd -876, H_cov -571 steps, only 14-25% of their collapse done at test-acc 50%) while only Nanda's restricted/excluded loss leads (+351 / +562). Re-analysing the SAME run as if stopped at the jump flips all three entropies positive (+298 / +386 / +146), showing the published lead is a normalization artifact of truncated training; and on a train_frac 0.3 run that never generalizes (test acc 0.028 vs chance 0.017) H_svd still falls 0.98 bits, a false positive."}, "result_summary": "Hypothesis refuted, with a mechanism for why the opposite is reported. The classic grokking curve reproduces cleanly at 57k params on (a+b) mod 59 in 2.5 minutes of CPU: train acc 0.99 at step 220, test acc 50% at step 862 (grok delay 642 steps), test acc 1.000 by step ~3000, and the grokked model is unambiguously Fourier - 6 frequencies hold 90.5% of the embedding power and H_fourier falls 4.85 -> 2.90 bits (28.8 -> 7.5 effective frequencies). The delay is governed by data: 642 steps at train_frac 0.5, 11,021 steps at 0.4 (still only 0.524 when the 360s cap hit), and no generalization at all at 0.3. On the only fully-grokked run, however, all three spectral entropies LAG the test-accuracy jump - H_fourier -936, H_svd -876, and H_cov -571 steps - having completed just 14-25% of their collapse at the moment test accuracy already reaches 50%. Only Nanda's restricted loss (+351 steps, monotone, 84% complete at the jump) and excluded loss (+562, but non-monotone with a 6.4x overshoot) genuinely fire early, and neither is causally available online because both require the FINAL model's key frequencies. Two controls explain the discrepancy with the published +1020-step claim: (1) re-analysing the SAME primary run as if training had stopped at the jump flips every entropy from lagging to leading (H_fourier -936 -> +298, H_svd -876 -> +386, H_cov -571 -> +146), because normalizing by 'fraction of total movement' while the denominator is still growing manufactures a lead - our own truncated train_frac 0.4 run reports fake leads of +4727 to +9466 for exactly this reason; (2) on the train_frac 0.3 run that memorizes but never leaves chance (test acc 0.028 vs chance 0.017 after 4388 steps), H_svd still falls 0.98 bits and H_fourier 0.12 bits with only 35.9% of power in the top 6 frequencies, i.e. entropy collapse fires without any generalization. H_cov, the published measure, was also the noisiest signal tracked (swinging 2.4-4.8 bits between adjacent evals) and moved the wrong way (+0.48 bits) in the null control. Net: at this scale there is no cheap ONLINE progress measure that both leads the jump and stays silent when the model never groks. Caveats: one seed, one modulus, one architecture, all runs wall-clock capped, and the prior work used p=97/d=128/train_frac 0.20 - a much longer plateau than fits a 10-minute box - so the sign of the lead may be regime-dependent.", "status": "done", "novelty_check": {"checked_on": "2026-07-26", "verdict": "partial-prior-art", "sources": [{"name": "web", "query": "spectral entropy of embedding matrix as grokking progress measure singular value spectrum", "hits": 6}, {"name": "web", "query": "Nanda progress measures grokking restricted loss excluded loss modular addition Fourier", "hits": 7}, {"name": "web", "query": "arXiv 2604.13123 Spectral Entropy Collapse Empirical Signature Delayed Generalisation Grokking", "hits": 7}, {"name": "webfetch", "query": "arxiv.org/html/2604.13123v1 - measure definition, p, lead time, comparison baselines", "hits": 1}, {"name": "webfetch", "query": "arxiv.org/html/2605.20441 - online grokking diagnostics, overlap check", "hits": 1}], "conclusion": "Spectral-entropy collapse as a grokking signature IS published: arXiv:2604.13123 proposes the entropy of the penultimate-representation covariance eigenspectrum at p=97, d_model=128, train_frac 0.20 and claims a mean lead of 1020 steps (95% CI [890, 1140]); it does NOT compare against restricted/excluded loss. arXiv:2605.20441 proposes disjoint attention-based online diagnostics. Nanda et al. 2301.05217 is the restricted/excluded-loss baseline. To our search, no prior work (a) benchmarks spectral-entropy-style measures head-to-head against restricted/excluded loss on the SAME runs, (b) reports a false-positive control (a memorized model that never generalizes), or (c) isolates the truncation/normalization artifact that can flip the sign of a reported lead. Those three are the contribution here; the grokking curve itself is a replication. arXiv/OpenAlex APIs 403 from this environment; verified via web search + page fetch."}, "prior_art": ["https://arxiv.org/abs/2604.13123", "https://arxiv.org/abs/2301.05217", "https://arxiv.org/abs/2201.02177", "https://arxiv.org/html/2605.20441", "https://github.com/mechanistic-interpretability-grokking/progress-measures-paper"], "related_ids": ["2026-07-25_shadow-halt-entropy-tiny"], "links": {"folder": "experiments/2026-07-25_grokking-modular-addition", "results_json": "experiments/2026-07-25_grokking-modular-addition/results.json", "chart": "experiments/2026-07-25_grokking-modular-addition/chart.png"}, "tags": ["track-b", "interpretability", "grokking", "modular-addition", "progress-measures", "spectral-entropy", "fourier", "restricted-loss", "excluded-loss", "negative-result", "measurement-validity", "false-positive-control", "checkpoint-available", "cpu-only"]}
