{"id": "2026-07-25_shadow-recursion-capacity-window", "date": "2026-07-25", "title": "Does the Game-of-Life capacity window transfer to language? Tied vs untied recursion across width", "slug": "shadow-recursion-capacity-window", "hypothesis": "The capacity-window result from registry id 2026-07-21_gol-depth-recursion (a weight-tied recurrent cell beats an untied per-step stack only inside a narrow hidden-width band) transfers to language modelling: at fixed loop count k=4 and fixed compute, a tied looped char-LM block beats k distinct untied blocks in validation bits/char only at intermediate model width, losing at both the narrow and the wide end.", "question": "Is the tied-vs-untied capacity window a general property of weight tying, or an artefact of tasks with an exact reusable update rule?", "method": "Pre-norm decoder-only char LM with k=4 block applications; tied = one block looped 4x, untied = 4 distinct blocks (identical FLOPs, untied has 2.3-3.6x params). Width sweep d in {16,32,64,128}; 400 steps, batch 16, context 128 (0.82M chars/run), AdamW with width-scaled peak lr 3e-3*sqrt(64/d) capped at 4.5e-3, 50-step warmup + cosine. Paired design: identical training batch stream per seed across all runs, one fixed 40-batch val set for all 16 runs, 2 seeds per cell.", "architecture": "looped decoder-only transformer, k=4 applications, d in {16,32,64,128} (7.4k-824k params)", "dataset": {"name": "tiny-shakespeare (character level, 65-char vocab)", "source": "https://raw.githubusercontent.com/karpathy/char-rnn/master/data/tinyshakespeare/input.txt", "license": "public domain text; karpathy/char-rnn MIT", "hash": "md5 6fb458f1232090904fb40fe944165e91"}, "task": "character-level language modelling / next-character prediction", "framework": "torch 2.13", "seed": 0, "compute": "CPU single-threaded, 463.5s for all 16 runs", "metrics": {"delta_bpc_d16": 0.0232, "delta_bpc_d32": 0.0694, "delta_bpc_d64": 0.0363, "delta_bpc_d128": -0.005, "tied_bpc_d128": 3.2642, "untied_bpc_d128": 3.2692, "tied_bpc_d32": 3.4882, "untied_bpc_d32": 3.4188, "capacity_window_found": 0, "headline": "no capacity window: untied wins at d=16/32/64 with a seed-consistent sign (delta +0.023/+0.069/+0.036 bits/char) and d=128 is parity (-0.005, sign flips across seeds); the tied penalty PEAKS at intermediate width and decays with width"}, "result_summary": "Hypothesis refuted - the Game-of-Life capacity window does not transfer to language. Weight tying never significantly helps: the untied 4-block stack wins at d=16, 32 and 64 with the sign consistent across both seeds, and the single negative delta (d=128, -0.005 bits/char) flips sign between seeds, i.e. parity not a win. The shape is the near-inverse of the GoL result: the tied penalty is largest at intermediate width (d=32, +0.069) and shrinks monotonically toward zero as width grows, hinting that any crossover lies above d=128 rather than in a narrow middle band. Ordering is stable across training checkpoints and train/val gaps are <0.05 bits/char, so untied's extra parameters buy fit rather than overfitting. Caveat: at 400 steps all models are undertrained (3.26-3.57 bits/char, roughly bigram-level), so this measures early-training iso-compute efficiency, not converged capacity.", "status": "done", "novelty_check": {"checked_on": "2026-07-25", "verdict": "partial-prior-art", "sources": [{"name": "web", "query": "looped transformer weight-tied vs untied width sweep capacity language model loss", "hits": 7}, {"name": "web", "query": "weight tying advantage only at intermediate model width capacity window recursion depth generalization", "hits": 9}], "conclusion": "Looped/weight-tied LMs are well covered at >=1.4B (Ouro 2510.25741, MoR 2507.10524) and recent depth/iso-depth scaling-law preprints exist, but none sweeps model WIDTH at fixed loop count to ask whether the tied-vs-untied sign changes, and none does so at <=1M params. The specific claim tested - that our own GoL capacity window generalizes - is refuted here. arXiv/OpenAlex APIs 403'd from this environment; used web search. 2026-dated preprints surfaced abstract-only and their numbers are not relied on."}, "prior_art": ["https://arxiv.org/abs/2510.25741", "https://arxiv.org/abs/2507.10524", "https://github.com/UW-Madison-Lee-Lab/looped-tf", "https://arxiv.org/abs/1807.03819"], "related_ids": ["2026-07-21_gol-depth-recursion", "2026-07-25_shadow-loop-vs-depth-isoflop"], "links": {"folder": "experiments/2026-07-25_shadow-recursion-capacity-window", "results_json": "experiments/2026-07-25_shadow-recursion-capacity-window/results.json", "chart": "experiments/2026-07-25_shadow-recursion-capacity-window/chart.png"}, "tags": ["shadow", "track-e", "latent-reasoning", "recursion", "weight-tying", "looped-transformer", "capacity-window", "transfer-test", "negative-result-for-hypothesis", "cpu-only"]}
