{"id": "2026-07-25_shadow-loop-vs-depth-isoflop", "date": "2026-07-25", "title": "Shadow E1: at iso-FLOPs on a 0.06-0.21M-param char LM, a weight-tied looped block loses to plain depth", "slug": "shadow-loop-vs-depth-isoflop", "hypothesis": "At matched training FLOPs on tiny natural-language data (<=0.25M params), a weight-tied block looped k times does NOT beat an untied k-layer stack - at this scale the extra parameters of untied depth buy more than the extra iterations of a shared block. Deliberate falsification target for Shadow's core mechanism.", "question": "Does Shadow's weight-tied looped block pay for itself against plain untied depth at iso-FLOPs on natural-language data at <=0.25M params, where Ouro/recurrent-depth have never been controlled?", "method": "nanoGPT-style pre-norm decoder-only char LM (d=64, 4 heads, FFN 256, ctx 64, vocab 65) on tiny-shakespeare, 90/10 split. For k in {1,2,4}: tied = ONE block applied k times (49.7k block params at every k); untied = k distinct blocks applied once each. Both do k block applications, hence identical fwd/bwd FLOPs per step. All 12 runs share 2200 steps, batch 16x64 tokens (~2.25M tokens), AdamW lr 2e-3 (100-step warmup, cosine to 10%), wd 0.1, clip 1.0, identical init and batch stream; 2 seeds per condition. Metric: val bits/char on a fixed 40-batch val set. Built-in check: tied-k1 and untied-k1 are the same model and must be bit-identical (gap = 0.0).", "architecture": "decoder-only transformer char LM, d_model 64, 4 heads, FFN 256, ctx 64; tied (1 block x k) vs untied (k blocks); 62k params (tied, all k) vs 62k/112k/211k params (untied k=1/2/4)", "dataset": {"name": "tiny-shakespeare (char-level)", "source": "https://raw.githubusercontent.com/karpathy/char-rnn/master/data/tinyshakespeare/input.txt", "license": "public domain text; char-rnn repo MIT", "hash": "md5:6fb458f1232090904fb40fe944165e91"}, "task": "character-level autoregressive language modelling (val bits/char at matched training FLOPs)", "framework": "torch 2.13 (CPU, single thread)", "seed": 0, "compute": "CPU 1 thread, 632s (10.5 min) for all 12 runs", "metrics": {"val_bpc_tied_k1": 2.7895, "val_bpc_untied_k1": 2.7895, "val_bpc_tied_k2": 2.827, "val_bpc_untied_k2": 2.7893, "val_bpc_tied_k4": 2.8724, "val_bpc_untied_k4": 2.7934, "tied_minus_untied_bpc_k2": 0.0377, "tied_minus_untied_bpc_k4": 0.079, "loop_gain_over_k1_bpc_k4": -0.0829, "depth_gain_over_k1_bpc_k4": -0.0039, "seed_std_max_bpc": 0.0187, "k1_sanity_gap_bpc": 0.0, "total_train_flops_k4": 2.879e+12, "headline": "loop LOSES at every k: tied-untied = +0.038 bpc at k=2 and +0.079 bpc at k=4 (fully seed-separated); and tied-k4 is 0.083 bpc WORSE than tied-k1 at 4x the FLOPs, while untied depth is flat (-0.004 bpc from k=1 to k=4)"}, "result_summary": "Hypothesis supported. At iso-FLOPs the weight-tied loop never beats untied depth and the penalty grows monotonically with k: +0.0377 bpc at k=2, +0.0790 bpc at k=4, with the tied and untied seed distributions fully separated at both k. Stronger still, looping is worse than not looping: tied-k4 spends 4x the FLOPs of tied-k1 at identical parameter count and ends 0.083 bpc worse. Secondary and arguably more useful finding: untied depth is itself nearly flat here (untied-k4 has 3.4x the params and 4x the FLOPs of untied-k1 yet lands within seed noise of it), so at <=0.25M params and ~1e12 training FLOPs extra forward compute buys almost nothing whichever way it is spent - depth is a wash, looping is a tax. Shadow's looped block cannot be justified on tiny-scale LM loss; it must earn its ledger entry on test-time-compute or extrapolation axes instead. Honest caveats: undertrained (all curves still descending at 2200 steps, ~2.79 bpc absolute), iso-hyperparameter rather than per-condition-tuned LR, and a VANILLA loop with no per-iteration input injection or per-loop LayerNorm.", "status": "done", "novelty_check": {"checked_on": "2026-07-25", "verdict": "partial-prior-art", "sources": [{"name": "web", "query": "weight-tied looped transformer vs depth iso-FLOP small language model 1M params recurrent depth control", "hits": 9}, {"name": "web", "query": "Ouro looped language model 2510.25741 parameter sharing iso-FLOP comparison untied depth baseline", "hits": 9}, {"name": "web", "query": "looped transformer parameter sharing tiny 1M parameter char-level language model does looping beat depth negative result", "hits": 8}], "conclusion": "The looped/weight-tied mechanism is thoroughly colonised at >=100M-1.4B+ params (Ouro 2510.25741, recurrent-depth 2502.05171, ICLR-2025 looping 2502.17416, and the closer iso-depth framings 2604.21106 / 2607.13491). No published loop-vs-depth iso-FLOP control at <=1M params on natural-language data was found. The fresh contribution is the <=0.25M-param char-level control, run as a falsification test with a bit-identical k=1 sanity check, where the loop clearly loses - a regime the large-scale literature does not report. arXiv/OpenAlex APIs 403 from this environment; verified via web search."}, "prior_art": ["https://arxiv.org/abs/2510.25741", "https://arxiv.org/pdf/2502.05171v1", "https://arxiv.org/pdf/2502.17416", "https://arxiv.org/html/2604.21106", "https://arxiv.org/abs/2607.13491"], "related_ids": ["2026-07-21_gol-depth-recursion"], "links": {"folder": "experiments/2026-07-25_shadow-loop-vs-depth-isoflop", "results_json": "experiments/2026-07-25_shadow-loop-vs-depth-isoflop/results.json", "chart": "experiments/2026-07-25_shadow-loop-vs-depth-isoflop/chart.png"}, "tags": ["shadow", "track-e", "tiny-ablation", "iso-flop", "weight-tying", "looped-transformer", "recurrent-depth", "char-lm", "falsification-target", "hypothesis-supported", "cpu-only"]}
