{"id": "2026-07-25_modern-hopfield-recall", "date": "2026-07-25", "title": "Modern Hopfield capacity at d=64 is exponential in d with the textbook constant (0.244 bits/dim, R2=0.993) but stops responding to beta above 1 - the update is just a nearest-neighbour decoder, and corruption, not temperature, is the binding constraint", "slug": "modern-hopfield-recall", "hypothesis": "The modern (continuous, softmax) Hopfield update xi <- X^T softmax(beta X xi) of Ramsauer et al. (arXiv:2008.02217) has capacity exponential in d, so at d=64 it retrieves corrupted queries from banks of thousands of random bipolar patterns - far past the classical Hebbian 0.14d ~ 9 - with a sharp retrieval boundary that moves outward as the inverse temperature beta grows, and at low beta retrieval collapses to metastable averages of many stored patterns.", "question": "What is the EMPIRICAL exact-retrieval capacity of a modern Hopfield associative memory on a joint (beta x corruption x N x d) grid, how does it compare to the classical Hebbian rule on identical pattern banks, and where does the metastable-averaging regime actually begin?", "method": "Hand-rolled, training-free numpy. Stored patterns X (N x d bipolar); modern update xi <- X^T softmax(beta X xi) iterated up to 10 steps or until max|dxi| < 1e-6, with the 1-step state recorded separately; classical reference W = X^T X / d with zero diagonal and 5 asynchronous random-order sign sweeps. Queries flip exactly round(f*d) components of a stored pattern, 500 queries per cell, nested RNG so every beta sees byte-identical queries. Exact retrieval = sign(xi_final) matches the true pattern in ALL d components; empirical capacity = largest N on a half-octave grid such that every swept N' <= N still clears 95% (first-crossing; the generous 'largest N anywhere above 95%' is also stored). Four sweeps: (1) d=64, N=2..4096 half-octave, beta in {0.25,1,4,16}, f in {0.1,0.2,0.3,0.4}, with the f=0.2 slice extended to N=65536; (2) classical Hebbian on the same banks (N<=256); (3) dimension sweep d in {16,24,32,40,48} at f=0.2, beta in {4,16}, with the d=64 point supplied by sweep 1 (same protocol, different bank - the only slice swept deep enough to be uncensored); (4) 1752 unique binarized 8x8 sklearn digits at d=64. Diagnostics per cell: cosine overlap, Hamming error, softmax participation ratio 1/sum(p^2), fixed-point norm ||xi||/sqrt(d), softmax argmax accuracy, and the query's nearest-neighbour margin.", "architecture": "modern (continuous, softmax-based) Hopfield network, no learned parameters - the memory IS the pattern matrix; classical Hebbian outer-product Hopfield as the reference", "dataset": {"name": "random bipolar patterns (+/-1) at d in {16,24,32,40,48,64}, plus 1752 unique binarized 8x8 sklearn digits", "source": "generated (numpy PCG64) / sklearn.datasets.load_digits", "license": "n/a / CC-BY-4.0 (UCI Optical Recognition of Handwritten Digits)"}, "task": "associative memory / pattern completion from corrupted queries", "framework": "numpy (torch imported only to pin set_num_threads(1))", "seed": 0, "compute": "CPU, 1 thread, 168s total for ~1100 retrieval cells; no training", "metrics": {"headline": "d=64, f=0.2, iterated: empirical capacity (largest N with >=95% exact retrieval) = beta 0.25: 2048, beta 1.0: 65536, beta 4.0: 65536, beta 16.0: 32768; classical Hebbian: 6 (0.14d = 9.0). capacity at f=0.3: beta 0.25: 64, beta 1.0: 64, beta 4.0: 64, beta 16.0: 64; at f=0.4: beta 0.25: 0, beta 1.0: 0, beta 4.0: 0, beta 16.0: 0", "capacity_d64_f0.2_beta0.25": 2048, "capacity_d64_f0.2_beta1": 65536, "capacity_d64_f0.2_beta1_censored": true, "capacity_d64_f0.2_beta4": 65536, "capacity_d64_f0.2_beta4_censored": true, "capacity_d64_f0.2_beta16": 32768, "capacity_d64_f0.2_1step_beta4": 32768, "capacity_d64_f0.1_all_betas_censored_at": 4096, "capacity_d64_f0.3_all_four_betas": 64, "capacity_d64_f0.4_all_four_betas": 0, "retrieval_rate_f0.4_N2_beta4": 0.918, "capacity_classical_f0.1": 6, "capacity_classical_f0.2": 6, "capacity_classical_f0.3": 3, "capacity_classical_f0.4": 0, "classical_theory_0.14d": 8.96, "modern_over_classical_f0.2": 10922.666666666666, "capacity_by_dim_beta16": {"d16": 11, "d24": 23, "d32": 128, "d40": 512, "d48": 1448, "d64": 32768}, "exp_fit_bits_per_dim_beta16": 0.2441180728909811, "exp_fit_r2_beta16": 0.9933919403736055, "exp_fit_bits_per_dim_beta4": 0.256969685083355, "exp_fit_r2_beta4": 0.963070689309194, "random_code_prediction_bits_per_dim_f0.2": 0.2597, "metastable_collapse_N_beta0.25": 2896, "retrieval_before_after_collapse_beta0.25": [0.996, 0.004], "participation_ratio_beta0.25_N65536": 784.22, "norm_ratio_beta0.25_N65536": 0.0051, "cos_to_true_beta0.25_N65536": 0.0045, "argmax_correct_beta0.25_N65536": 0.968, "argmax_correct_beta16_N65536": 0.968, "nn_decoder_correct_N65536_f0.2": 0.944, "exact_retrieval_beta4_N65536_f0.2": 0.966, "capacity_digits_f0.1_beta4": 181, "capacity_digits_f0.2_beta4_first_crossing": 2, "capacity_digits_f0.2_beta4_last_above": 11, "digits_mean_abs_cos": 0.487, "random_mean_abs_cos_expected": 0.1}, "result_summary": "Split verdict. CONFIRMED: capacity is exponential in d with the textbook constant - log2(capacity) vs d over d=16,24,32,40,48,64 at f=0.2 is linear at 0.244 bits/dim (R2=0.993) at beta=16 and 0.257 bits/dim (R2=0.963) at beta=4, within 6% of the random-code prediction (1-2f)^2/(2 ln 2)=0.2597; at d=64, f=0.2 the empirical capacity is >=65536 (censored, 96.6% exact retrieval at the largest bank swept) versus 6 for the classical Hebbian rule on the identical bank (theory 0.14d=9), a ~10^4x gap. REFUTED: the boundary does not move with beta above 1. At f=0.3 all four temperatures give exactly the same capacity (64) and at f=0.2 beta=16 is marginally worse than beta=4, because for beta>=1 the exact-retrieval curve sits on top of the nearest-neighbour-decoder curve (0.966 vs 0.944 at N=65536, the gap being integer-overlap ties) - the softmax adds nothing over 'snap to the closest stored pattern'. Beta is a floor, not a dial: the only visible beta effect is a 32x jump between 0.25 and 1. The binding constraint is corruption, not temperature or N: d=64 holds >=65536 patterns at f=0.2, 64 at f=0.3, and fewer than 2 at f=0.4 (a two-pattern memory completes only 91.8% of 40%-corrupted queries). Metastability CONFIRMED and sharp: at beta=0.25 retrieval goes 0.996 (N=2048) -> 0.004 (N=2896) in one half-octave, after which the softmax participation ratio reaches 784 effective patterns and the fixed point has 0.005*sqrt(d) norm and cosine 0.005 to the truth - but the true pattern is STILL the softmax argmax for 96.8% of queries, identical to beta=16, so the collapse is a readout failure with the memory intact; iterating makes it worse (1-step capacity 2896 vs iterated 2048) because each step shrinks the state norm and hence the effective temperature. Correlated real patterns (binarized 8x8 digits, mean |cos| 0.487 vs 0.100 random) lose nearly everything: capacity 128-181 at f=0.1 and never above 95% past N=11 at f=0.2.", "status": "done", "novelty_check": {"checked_on": "2026-07-26", "verdict": "partial-prior-art", "sources": [{"name": "web", "query": "modern Hopfield network empirical storage capacity experiment beta softmax retrieval bipolar patterns exponential capacity", "hits": 10}, {"name": "web", "query": "'modern Hopfield' metastable states low beta averaging similar patterns empirical capacity vs corruption fraction numpy replication", "hits": 8}], "conclusion": "The exponential-capacity theorem (Ramsauer 2008.02217), its optimal-capacity refinement (2410.23126, NeurIPS 2024), the uniform-retrieval variant (2404.03827) and the correlated-data capacity loss (2503.09518) are all established, and ml-jku/hopfield-layers ships the metastable-state illustration. This is therefore a measurement rather than a new mechanism. Two observations were not found stated in that literature: (a) the retrieval boundary stops responding to beta above ~1 because the update degenerates to a nearest-neighbour decoder over the corrupted query (exact retrieval tracks the NN margin to within integer-overlap ties), so beta is a floor rather than a capacity dial; and (b) in the metastable regime the softmax argmax remains correct for 96.8% of queries while the retrieved state has 0.5% of a pattern's norm, i.e. the low-beta collapse is a readout failure with storage intact. The published results are theorems with retrieval-error tolerances; measured here is exact all-d-components retrieval on a joint (beta x corruption x N x d) grid with the classical Hebbian rule run on identical banks. arXiv/OpenAlex APIs 403 from this environment; web search used instead."}, "prior_art": ["https://arxiv.org/abs/2008.02217", "https://github.com/ml-jku/hopfield-layers", "https://arxiv.org/html/2410.23126v2", "https://arxiv.org/html/2503.09518", "https://arxiv.org/html/2404.03827v3"], "related_ids": [], "links": {"folder": "experiments/2026-07-25_modern-hopfield-recall", "results_json": "experiments/2026-07-25_modern-hopfield-recall/results.json", "chart": "experiments/2026-07-25_modern-hopfield-recall/chart.png"}, "tags": ["non-transformer", "associative-memory", "modern-hopfield", "capacity", "pattern-completion", "metastable-states", "no-training", "numpy", "cpu-only"]}
